{
  "schemaVersion": "rinspace-world-routes/v1",
  "contractVersion": "1.0.2",
  "generatedFrom": [
    "src/app/routing/routeManifest.tsx",
    "config/world-routes.json"
  ],
  "worldQuery": {
    "parameter": "world",
    "innerValue": "inner",
    "outerRepresentation": "omitted",
    "invalidValue": "strip-and-use-route-default"
  },
  "resolutionOrder": [
    "service",
    "federation-disabled",
    "reserved",
    "inner-only",
    "dual",
    "outer-only",
    "unmatched"
  ],
  "manifestCoverage": {
    "routeCount": 85,
    "orderedPathSha256": "sha256:eb3e44e77f8585e984f718d905315957cd1d57ed45e5f5635022f211b198ad0b"
  },
  "routes": [
    {
      "id": "service.rinspace-api",
      "pattern": "/rinspace/api/*",
      "kind": "service",
      "priority": 100,
      "owners": [
        "rinspace-private"
      ],
      "anonymousPolicy": "service-policy",
      "flip": "none",
      "canonicalWorld": "not-applicable",
      "source": "shared-contract"
    },
    {
      "id": "service.rinspace-admin-api",
      "pattern": "/rinspace/admin/api/*",
      "kind": "service",
      "priority": 101,
      "owners": [
        "rinspace-private"
      ],
      "anonymousPolicy": "service-policy",
      "flip": "none",
      "canonicalWorld": "not-applicable",
      "source": "shared-contract"
    },
    {
      "id": "service.rinspace-auth",
      "pattern": "/rinspace/auth/*",
      "kind": "service",
      "priority": 102,
      "owners": [
        "rinspace-private"
      ],
      "anonymousPolicy": "service-policy",
      "flip": "none",
      "canonicalWorld": "not-applicable",
      "source": "shared-contract"
    },
    {
      "id": "service.mastodon-streaming",
      "pattern": "/api/v1/streaming/*",
      "kind": "service",
      "priority": 109,
      "owners": [
        "mastodon"
      ],
      "anonymousPolicy": "service-policy",
      "flip": "none",
      "canonicalWorld": "not-applicable",
      "source": "shared-contract"
    },
    {
      "id": "service.mastodon-api",
      "pattern": "/api/*",
      "kind": "service",
      "priority": 110,
      "owners": [
        "mastodon"
      ],
      "anonymousPolicy": "service-policy",
      "flip": "none",
      "canonicalWorld": "not-applicable",
      "source": "shared-contract"
    },
    {
      "id": "service.mastodon-oauth",
      "pattern": "/oauth/*",
      "kind": "service",
      "priority": 111,
      "owners": [
        "mastodon"
      ],
      "anonymousPolicy": "service-policy",
      "flip": "none",
      "canonicalWorld": "not-applicable",
      "source": "shared-contract"
    },
    {
      "id": "service.mastodon-auth",
      "pattern": "/auth/*",
      "kind": "service",
      "priority": 112,
      "owners": [
        "mastodon"
      ],
      "anonymousPolicy": "service-policy",
      "flip": "none",
      "canonicalWorld": "not-applicable",
      "source": "shared-contract"
    },
    {
      "id": "service.mastodon-packs",
      "pattern": "/packs/*",
      "kind": "service",
      "priority": 114,
      "owners": [
        "mastodon"
      ],
      "anonymousPolicy": "public",
      "flip": "none",
      "canonicalWorld": "not-applicable",
      "source": "shared-contract"
    },
    {
      "id": "service.mastodon-system-media",
      "pattern": "/system/*",
      "kind": "service",
      "priority": 115,
      "owners": [
        "mastodon"
      ],
      "anonymousPolicy": "runtime-policy",
      "flip": "none",
      "canonicalWorld": "not-applicable",
      "source": "shared-contract"
    },
    {
      "id": "service.outer-static",
      "pattern": "/static/*",
      "kind": "service",
      "priority": 120,
      "owners": [
        "rinspace-web"
      ],
      "anonymousPolicy": "public",
      "flip": "none",
      "canonicalWorld": "not-applicable",
      "source": "shared-contract"
    },
    {
      "id": "service.outer-assets",
      "pattern": "/assets/*",
      "kind": "service",
      "priority": 121,
      "owners": [
        "rinspace-web"
      ],
      "anonymousPolicy": "public",
      "flip": "none",
      "canonicalWorld": "not-applicable",
      "source": "shared-contract"
    },
    {
      "id": "service.outer-fonts",
      "pattern": "/fonts/*",
      "kind": "service",
      "priority": 122,
      "owners": [
        "rinspace-web"
      ],
      "anonymousPolicy": "public",
      "flip": "none",
      "canonicalWorld": "not-applicable",
      "source": "shared-contract"
    },
    {
      "id": "service.outer-index-document",
      "pattern": "/index.html",
      "kind": "service",
      "priority": 123,
      "owners": [
        "rinspace-web"
      ],
      "anonymousPolicy": "public",
      "flip": "none",
      "canonicalWorld": "not-applicable",
      "source": "shared-contract"
    },
    {
      "id": "service.outer-apple-touch-icon",
      "pattern": "/apple-touch-icon.png",
      "kind": "service",
      "priority": 124,
      "owners": [
        "rinspace-web"
      ],
      "anonymousPolicy": "public",
      "flip": "none",
      "canonicalWorld": "not-applicable",
      "source": "shared-contract"
    },
    {
      "id": "service.outer-asset-manifest",
      "pattern": "/asset-manifest.json",
      "kind": "service",
      "priority": 125,
      "owners": [
        "rinspace-web"
      ],
      "anonymousPolicy": "public",
      "flip": "none",
      "canonicalWorld": "not-applicable",
      "source": "shared-contract"
    },
    {
      "id": "service.outer-bootstrap-theme",
      "pattern": "/bootstrap-theme.js",
      "kind": "service",
      "priority": 126,
      "owners": [
        "rinspace-web"
      ],
      "anonymousPolicy": "public",
      "flip": "none",
      "canonicalWorld": "not-applicable",
      "source": "shared-contract"
    },
    {
      "id": "service.outer-favicon-32",
      "pattern": "/favicon-32x32.png",
      "kind": "service",
      "priority": 127,
      "owners": [
        "rinspace-web"
      ],
      "anonymousPolicy": "public",
      "flip": "none",
      "canonicalWorld": "not-applicable",
      "source": "shared-contract"
    },
    {
      "id": "service.outer-favicon-192",
      "pattern": "/favicon-192x192.png",
      "kind": "service",
      "priority": 128,
      "owners": [
        "rinspace-web"
      ],
      "anonymousPolicy": "public",
      "flip": "none",
      "canonicalWorld": "not-applicable",
      "source": "shared-contract"
    },
    {
      "id": "service.outer-favicon-512",
      "pattern": "/favicon-512x512.png",
      "kind": "service",
      "priority": 129,
      "owners": [
        "rinspace-web"
      ],
      "anonymousPolicy": "public",
      "flip": "none",
      "canonicalWorld": "not-applicable",
      "source": "shared-contract"
    },
    {
      "id": "service.outer-favicon",
      "pattern": "/favicon.ico",
      "kind": "service",
      "priority": 130,
      "owners": [
        "rinspace-web"
      ],
      "anonymousPolicy": "public",
      "flip": "none",
      "canonicalWorld": "not-applicable",
      "source": "shared-contract"
    },
    {
      "id": "service.outer-msw",
      "pattern": "/mockServiceWorker.js",
      "kind": "service",
      "priority": 131,
      "owners": [
        "rinspace-web"
      ],
      "anonymousPolicy": "public",
      "flip": "none",
      "canonicalWorld": "not-applicable",
      "source": "shared-contract"
    },
    {
      "id": "service.outer-profile-cover",
      "pattern": "/profile-cover.svg",
      "kind": "service",
      "priority": 132,
      "owners": [
        "rinspace-web"
      ],
      "anonymousPolicy": "public",
      "flip": "none",
      "canonicalWorld": "not-applicable",
      "source": "shared-contract"
    },
    {
      "id": "service.outer-rin-avatar",
      "pattern": "/rin.png",
      "kind": "service",
      "priority": 133,
      "owners": [
        "rinspace-web"
      ],
      "anonymousPolicy": "public",
      "flip": "none",
      "canonicalWorld": "not-applicable",
      "source": "shared-contract"
    },
    {
      "id": "service.outer-version",
      "pattern": "/version.json",
      "kind": "service",
      "priority": 134,
      "owners": [
        "rinspace-web"
      ],
      "anonymousPolicy": "public",
      "flip": "none",
      "canonicalWorld": "not-applicable",
      "source": "shared-contract"
    },
    {
      "id": "service.mastodon-manifest",
      "pattern": "/manifest",
      "kind": "service",
      "priority": 140,
      "owners": [
        "mastodon"
      ],
      "anonymousPolicy": "public",
      "flip": "none",
      "canonicalWorld": "not-applicable",
      "source": "shared-contract"
    },
    {
      "id": "service.mastodon-worker",
      "pattern": "/sw.js",
      "kind": "service",
      "priority": 141,
      "owners": [
        "mastodon"
      ],
      "anonymousPolicy": "public",
      "flip": "none",
      "canonicalWorld": "not-applicable",
      "source": "shared-contract"
    },
    {
      "id": "service.rinspace-robots",
      "pattern": "/robots.txt",
      "kind": "service",
      "priority": 142,
      "owners": [
        "rinspace-private"
      ],
      "anonymousPolicy": "public",
      "flip": "none",
      "canonicalWorld": "not-applicable",
      "source": "shared-contract"
    },
    {
      "id": "service.repos",
      "pattern": "/repos/*",
      "kind": "service",
      "priority": 160,
      "owners": [
        "rinspace-private"
      ],
      "anonymousPolicy": "service-policy",
      "flip": "none",
      "canonicalWorld": "not-applicable",
      "source": "shared-contract"
    },
    {
      "id": "service.rin",
      "pattern": "/rin/*",
      "kind": "service",
      "priority": 161,
      "owners": [
        "rinspace-private"
      ],
      "anonymousPolicy": "service-policy",
      "flip": "none",
      "canonicalWorld": "not-applicable",
      "source": "shared-contract"
    },
    {
      "id": "service.quiver",
      "pattern": "/quiver/*",